{
  "schema_version": "simflow.toolchain_capabilities.v1",
  "policy": "Domain Assistant is a Skill product role, helper support is a tool/capability support level, and simflow.helper_evidence.v1 is an optional helper-evidence output contract; these concepts are independent. Helper support does not define software admission, real execution support, or workflow blocking. Tracked-only and unknown tools may still be planned and recorded for provenance. Real execution, submit, credentials, and unsupported scientific claims remain governed by safety gates and evidence checks.",
  "helper_supported_software": [
    "vasp",
    "cp2k",
    "lammps",
    "gpumd",
    "nep"
  ],
  "capability_supported_tools": [],
  "tracked_only_software": [
    "abinit",
    "allegro",
    "ase",
    "calorine",
    "custom",
    "deepmd",
    "dpgen",
    "gromacs",
    "mace",
    "neptrain",
    "neptrainkit",
    "nequip",
    "openmm",
    "packmol",
    "phonopy",
    "python",
    "quantum_espresso"
  ],
  "aliases": {
    "qe": "quantum_espresso",
    "quantum-espresso": "quantum_espresso",
    "quantumespresso": "quantum_espresso",
    "open_mm": "openmm",
    "deep_md": "deepmd",
    "deepmd-kit": "deepmd",
    "deepmd_kit": "deepmd",
    "nep_train_kit": "neptrainkit",
    "nep-train-kit": "neptrainkit",
    "nep_train": "neptrain"
  },
  "capability_support": {
    "gpumd": {
      "supported": [
        "static_input_inspection",
        "input_generation",
        "input_validation",
        "compute_planning",
        "orchestration",
        "manifest_generation",
        "selected_output_parsing",
        "evidence_handoff"
      ],
      "not_helper_supported": [
        "real_execution",
        "local_submit",
        "remote_execution",
        "hpc_submit"
      ]
    },
    "nep": {
      "supported": [
        "static_input_inspection",
        "input_generation",
        "input_validation",
        "compute_planning",
        "orchestration",
        "manifest_generation",
        "selected_output_parsing",
        "evidence_handoff"
      ],
      "not_helper_supported": [
        "real_execution",
        "local_submit",
        "remote_execution",
        "hpc_submit"
      ]
    }
  }
}
